onnx2trt_logs.txt
[11/08/2024-09:04:20] [V] [TRT] *************** Autotuning Reformat: Float(49152,16384,128,1) -> Float(49152,1,384,3) ***************
[11/08/2024-09:04:20] [V] [TRT] --------------- Timing Runner: Optimizer Reformat(input -> <out>) (Reformat)
[11/08/2024-09:04:20] [V] [TRT] Tactic: 1002 Time: 0.049968
[11/08/2024-09:04:20] [V] [TRT] Tactic: 0 Time: 0.032968
[11/08/2024-09:04:20] [V] [TRT] Fastest Tactic: 0 Time: 0.032968
[11/08/2024-09:04:20] [V] [TRT] =============== Computing reformatting costs
[11/08/2024-09:04:20] [V] [TRT] *************** Autotuning Reformat: Float(524288,16384,128,1) -> Float(524288,1,4096,32) ***************
[11/08/2024-09:04:20] [V] [TRT] --------------- Timing Runner: Optimizer Reformat(/Relu_output_0 -> <out>) (Reformat)
[11/08/2024-09:04:20] [V] [TRT] Tactic: 1002 Time: 0.50516
[11/08/2024-09:04:20] [V] [TRT] Tactic: 0 Time: 0.488912
[11/08/2024-09:04:20] [V] [TRT] Fastest Tactic: 0 Time: 0.488912
[11/08/2024-09:04:20] [V] [TRT] *************** Autotuning Reformat: Float(524288,1,4096,32) -> Float(524288,16384,128,1) ***************
[11/08/2024-09:04:20] [V] [TRT] --------------- Timing Runner: Optimizer Reformat(/Relu_output_0 -> <out>) (Reformat)
[11/08/2024-09:04:20] [V] [TRT] Tactic: 1002 Time: 0.511484
[11/08/2024-09:04:20] [V] [TRT] Tactic: 0 Time: 1.16687
[11/08/2024-09:04:20] [V] [TRT] Fastest Tactic: 1002 Time: 0.511484
[11/08/2024-09:04:20] [V] [TRT] =============== Computing reformatting costs
[11/08/2024-09:04:20] [V] [TRT] *************** Autotuning Reformat: Float(524288,1,4096,32) -> Float(524288,16384,128,1) ***************
[11/08/2024-09:04:20] [V] [TRT] =============== Computing reformatting costs
[11/08/2024-09:04:20] [V] [TRT] *************** Autotuning Reformat: Float(131072,4096,64,1) -> Float(131072,1,2048,32) ***************
[11/08/2024-09:04:20] [V] [TRT] --------------- Timing Runner: Optimizer Reformat(<in> -> /pool/MaxPool_output_0) (Reformat)
[11/08/2024-09:04:20] [V] [TRT] Tactic: 1002 Time: 0.137248
[11/08/2024-09:04:20] [V] [TRT] Tactic: 0 Time: 0.124284
[11/08/2024-09:04:20] [V] [TRT] Fastest Tactic: 0 Time: 0.124284
[11/08/2024-09:04:20] [V] [TRT] =============== Computing reformatting costs
[11/08/2024-09:04:20] [V] [TRT] *************** Autotuning Reformat: Float(131072,4096,64,1) -> Float(131072,1,2048,32) ***************
[11/08/2024-09:04:20] [V] [TRT] --------------- Timing Runner: Optimizer Reformat(/pool/MaxPool_output_0 -> <out>) (Reformat)
[11/08/2024-09:04:20] [V] [TRT] Tactic: 1002 Time: 0.13822
[11/08/2024-09:04:20] [V] [TRT] Tactic: 0 Time: 0.12896
[11/08/2024-09:04:20] [V] [TRT] Fastest Tactic: 0 Time: 0.12896
[11/08/2024-09:04:20] [V] [TRT] *************** Autotuning Reformat: Float(131072,1,2048,32) -> Float(131072,4096,64,1) ***************
[11/08/2024-09:04:20] [V] [TRT] --------------- Timing Runner: Optimizer Reformat(/pool/MaxPool_output_0 -> <out>) (Reformat)
[11/08/2024-09:04:20] [V] [TRT] Tactic: 1002 Time: 0.138292
[11/08/2024-09:04:20] [V] [TRT] Tactic: 0 Time: 0.158944
[11/08/2024-09:04:20] [V] [TRT] Fastest Tactic: 1002 Time: 0.138292
[11/08/2024-09:04:20] [V] [TRT] =============== Computing reformatting costs
[11/08/2024-09:04:20] [V] [TRT] *************** Autotuning Reformat: Float(262144,1,4096,64) -> Float(262144,4096,64,1) ***************
[11/08/2024-09:04:20] [V] [TRT] --------------- Timing Runner: Optimizer Reformat(/Relu_2_output_0 -> <out>) (Reformat)
[11/08/2024-09:04:20] [V] [TRT] Tactic: 1002 Time: 0.184812
[11/08/2024-09:04:20] [V] [TRT] Tactic: 0 Time: 0.315864
[11/08/2024-09:04:20] [V] [TRT] Fastest Tactic: 1002 Time: 0.184812
[11/08/2024-09:04:20] [V] [TRT] =============== Computing reformatting costs
[11/08/2024-09:04:20] [V] [TRT] *************** Autotuning Reformat: Float(65536,1024,32,1) -> Float(65536,1,2048,64) ***************
[11/08/2024-09:04:20] [V] [TRT] --------------- Timing Runner: Optimizer Reformat(<in> -> /pool_1/MaxPool_output_0) (Reformat)
[11/08/2024-09:04:20] [V] [TRT] Tactic: 1002 Time: 0.033508
[11/08/2024-09:04:20] [V] [TRT] Tactic: 0 Time: 0.054388
[11/08/2024-09:04:20] [V] [TRT] Fastest Tactic: 1002 Time: 0.033508
[11/08/2024-09:04:20] [V] [TRT] =============== Computing reformatting costs
[11/08/2024-09:04:20] [V] [TRT] *************** Autotuning Reformat: Float(65536,1024,32,1) -> Float(65536,1,2048,64) ***************
[11/08/2024-09:04:20] [V] [TRT] --------------- Timing Runner: Optimizer Reformat(/pool_1/MaxPool_output_0 -> <out>) (Reformat)
[11/08/2024-09:04:20] [V] [TRT] Tactic: 1002 Time: 0.033156
[11/08/2024-09:04:20] [V] [TRT] Tactic: 0 Time: 0.048892
[11/08/2024-09:04:20] [V] [TRT] Fastest Tactic: 1002 Time: 0.033156
[11/08/2024-09:04:20] [V] [TRT] *************** Autotuning Reformat: Float(65536,1,2048,64) -> Float(65536,1024,32,1) ***************
[11/08/2024-09:04:20] [V] [TRT] --------------- Timing Runner: Optimizer Reformat(/pool_1/MaxPool_output_0 -> <out>) (Reformat)
[11/08/2024-09:04:20] [V] [TRT] Tactic: 1002 Time: 0.045168
[11/08/2024-09:04:20] [V] [TRT] Tactic: 0 Time: 0.041736
[11/08/2024-09:04:20] [V] [TRT] Fastest Tactic: 0 Time: 0.041736
[11/08/2024-09:04:20] [V] [TRT] =============== Computing reformatting costs
[11/08/2024-09:04:20] [V] [TRT] *************** Autotuning Reformat: Float(98304,1,3072,96) -> Float(98304,1024,32,1) ***************
[11/08/2024-09:04:20] [V] [TRT] --------------- Timing Runner: Optimizer Reformat(/Relu_3_output_0 -> <out>) (Reformat)
[11/08/2024-09:04:20] [V] [TRT] Tactic: 1002 Time: 0.0874
[11/08/2024-09:04:20] [V] [TRT] Tactic: 0 Time: 0.073512
[11/08/2024-09:04:20] [V] [TRT] Fastest Tactic: 0 Time: 0.073512
[11/08/2024-09:04:20] [V] [TRT] =============== Computing reformatting costs
[11/08/2024-09:04:20] [V] [TRT] *************** Autotuning Reformat: Float(24576,256,16,1) -> Float(24576,1,1536,96) ***************
[11/08/2024-09:04:20] [V] [TRT] --------------- Timing Runner: Optimizer Reformat(<in> -> /pool_2/MaxPool_output_0) (Reformat)
[11/08/2024-09:04:20] [V] [TRT] Tactic: 1002 Time: 0.021988
[11/08/2024-09:04:20] [V] [TRT] Tactic: 0 Time: 0.018572
[11/08/2024-09:04:20] [V] [TRT] Fastest Tactic: 0 Time: 0.018572
[11/08/2024-09:04:20] [V] [TRT] =============== Computing reformatting costs
[11/08/2024-09:04:20] [V] [TRT] *************** Autotuning Reformat: Float(24576,256,16,1) -> Float(24576,1,1536,96) ***************
[11/08/2024-09:04:20] [V] [TRT] --------------- Timing Runner: Optimizer Reformat(/pool_2/MaxPool_output_0 -> <out>) (Reformat)
[11/08/2024-09:04:20] [V] [TRT] Tactic: 1002 Time: 0.021808
[11/08/2024-09:04:20] [V] [TRT] Tactic: 0 Time: 0.018764
[11/08/2024-09:04:20] [V] [TRT] Fastest Tactic: 0 Time: 0.018764
[11/08/2024-09:04:20] [V] [TRT] *************** Autotuning Reformat: Float(24576,1,1536,96) -> Float(24576,256,16,1) ***************
[11/08/2024-09:04:20] [V] [TRT] --------------- Timing Runner: Optimizer Reformat(/pool_2/MaxPool_output_0 -> <out>) (Reformat)
[11/08/2024-09:04:20] [V] [TRT] Tactic: 1002 Time: 0.024784
[11/08/2024-09:04:20] [V] [TRT] Tactic: 0 Time: 0.016844
[11/08/2024-09:04:20] [V] [TRT] Fastest Tactic: 0 Time: 0.016844
[11/08/2024-09:04:20] [V] [TRT] =============== Computing reformatting costs
[11/08/2024-09:04:20] [V] [TRT] *************** Autotuning Reformat: Float(24576,1,1536,96) -> Float(24576,256,16,1) ***************
[11/08/2024-09:04:20] [V] [TRT] =============== Computing reformatting costs
[11/08/2024-09:04:20] [V] [TRT] =============== Computing reformatting costs
[11/08/2024-09:04:20] [V] [TRT] =============== Computing reformatting costs
[11/08/2024-09:04:20] [V] [TRT] =============== Computing reformatting costs
[11/08/2024-09:04:20] [V] [TRT] =============== Computing reformatting costs
[11/08/2024-09:04:20] [V] [TRT] *************** Autotuning Reformat: Float(6144,1,1,1) -> Float(6144,1,6144,6144) ***************
[11/08/2024-09:04:20] [V] [TRT] --------------- Timing Runner: Optimizer Reformat(<in> -> (Unnamed Layer* 15) [Shuffle]_output) (Reformat)
[11/08/2024-09:04:20] [V] [TRT] Tactic: 1002 Time: 0.012472
[11/08/2024-09:04:20] [V] [TRT] Tactic: 0 Time: 0.006848
[11/08/2024-09:04:20] [V] [TRT] Fastest Tactic: 0 Time: 0.006848
[11/08/2024-09:04:20] [V] [TRT] =============== Computing reformatting costs
[11/08/2024-09:04:20] [V] [TRT] *************** Autotuning Reformat: Float(6144,1,1,1) -> Float(6144,1,6144,6144) ***************
[11/08/2024-09:04:20] [V] [TRT] --------------- Timing Runner: Optimizer Reformat((Unnamed Layer* 15) [Shuffle]_output -> <out>) (Reformat)
[11/08/2024-09:04:20] [V] [TRT] Tactic: 1002 Time: 0.006964
[11/08/2024-09:04:20] [V] [TRT] Tactic: 0 Time: 0.006828
[11/08/2024-09:04:20] [V] [TRT] Fastest Tactic: 0 Time: 0.006828
[11/08/2024-09:04:20] [V] [TRT] *************** Autotuning Reformat: Float(6144,1,6144,6144) -> Float(6144,1,1,1) ***************
[11/08/2024-09:04:20] [V] [TRT] --------------- Timing Runner: Optimizer Reformat((Unnamed Layer* 15) [Shuffle]_output -> <out>) (Reformat)
[11/08/2024-09:04:20] [V] [TRT] Tactic: 1002 Time: 0.007732
[11/08/2024-09:04:20] [V] [TRT] Tactic: 0 Time: 0.00668
[11/08/2024-09:04:20] [V] [TRT] Fastest Tactic: 0 Time: 0.00668
[11/08/2024-09:04:20] [V] [TRT] =============== Computing reformatting costs
[11/08/2024-09:04:20] [V] [TRT] *************** Autotuning Reformat: Float(384,1,1,1) -> Float(384,1,384,384) ***************
[11/08/2024-09:04:20] [V] [TRT] --------------- Timing Runner: Optimizer Reformat(<in> -> /heads.0/fc_1_phone/Gemm + /heads.0/relu_1_phone/Relu || /heads.1/fc_1_gaze/Gemm + /heads.1/relu_1_gaze/Relu || /heads.2/fc_1_headset/Gemm + /heads.2/relu_1_headset/Relu) (Reformat)
[11/08/2024-09:04:20] [V] [TRT] Tactic: 1002 Time: 0.004908
[11/08/2024-09:04:20] [V] [TRT] Tactic: 0 Time: 0.003172
[11/08/2024-09:04:20] [V] [TRT] Fastest Tactic: 0 Time: 0.003172
[11/08/2024-09:04:20] [V] [TRT] *************** Autotuning Reformat: Float(384,1,384,384) -> Float(384,1,1,1) ***************
[11/08/2024-09:04:20] [V] [TRT] --------------- Timing Runner: Optimizer Reformat(<in> -> /heads.0/fc_1_phone/Gemm + /heads.0/relu_1_phone/Relu || /heads.1/fc_1_gaze/Gemm + /heads.1/relu_1_gaze/Relu || /heads.2/fc_1_headset/Gemm + /heads.2/relu_1_headset/Relu) (Reformat)
[11/08/2024-09:04:20] [V] [TRT] Tactic: 1002 Time: 0.004988
[11/08/2024-09:04:20] [V] [TRT] Tactic: 0 Time: 0.00334
[11/08/2024-09:04:20] [V] [TRT] Fastest Tactic: 0 Time: 0.00334
[11/08/2024-09:04:20] [V] [TRT] =============== Computing reformatting costs
[11/08/2024-09:04:20] [V] [TRT] *************** Autotuning Reformat: Float(384,1,1,1) -> Float(384,1,384,384) ***************
[11/08/2024-09:04:20] [V] [TRT] --------------- Timing Runner: Optimizer Reformat(/heads.0/relu_1_phone/Relu_out_tensor -> <out>) (Reformat)
[11/08/2024-09:04:20] [V] [TRT] Tactic: 1002 Time: 0.02462
[11/08/2024-09:04:20] [V] [TRT] Tactic: 0 Time: 0.009168
[11/08/2024-09:04:20] [V] [TRT] Fastest Tactic: 0 Time: 0.009168
[11/08/2024-09:04:20] [V] [TRT] *************** Autotuning Reformat: Float(384,1,384,384) -> Float(384,1,1,1) ***************
[11/08/2024-09:04:20] [V] [TRT] --------------- Timing Runner: Optimizer Reformat(/heads.0/relu_1_phone/Relu_out_tensor -> <out>) (Reformat)
[11/08/2024-09:04:20] [V] [TRT] Tactic: 1002 Time: 0.023104
[11/08/2024-09:04:21] [V] [TRT] Tactic: 0 Time: 0.008848
[11/08/2024-09:04:21] [V] [TRT] Fastest Tactic: 0 Time: 0.008848
[11/08/2024-09:04:21] [V] [TRT] =============== Computing reformatting costs
[11/08/2024-09:04:21] [V] [TRT] *************** Autotuning Reformat: Float(5,1,5,5) -> Float(5,1,1,1) ***************
[11/08/2024-09:04:21] [V] [TRT] --------------- Timing Runner: Optimizer Reformat((Unnamed Layer* 20) [Fully Connected]_output -> <out>) (Reformat)
[11/08/2024-09:04:21] [V] [TRT] Tactic: 1002 Time: 0.02058
[11/08/2024-09:04:21] [V] [TRT] Tactic: 0 Time: 0.003196
[11/08/2024-09:04:21] [V] [TRT] Fastest Tactic: 0 Time: 0.003196
[11/08/2024-09:04:21] [V] [TRT] =============== Computing reformatting costs
[11/08/2024-09:04:21] [V] [TRT] =============== Computing reformatting costs
[11/08/2024-09:04:21] [V] [TRT] =============== Computing reformatting costs
[11/08/2024-09:04:21] [V] [TRT] =============== Computing reformatting costs
[11/08/2024-09:04:21] [V] [TRT] *************** Autotuning Reformat: Float(384,1,1,1) -> Float(384,1,384,384) ***************
[11/08/2024-09:04:21] [V] [TRT] *************** Autotuning Reformat: Float(384,1,384,384) -> Float(384,1,1,1) ***************
[11/08/2024-09:04:21] [V] [TRT] =============== Computing reformatting costs
[11/08/2024-09:04:21] [V] [TRT] *************** Autotuning Reformat: Float(5,1,5,5) -> Float(5,1,1,1) ***************
[11/08/2024-09:04:21] [V] [TRT] =============== Computing reformatting costs
[11/08/2024-09:04:21] [V] [TRT] =============== Computing reformatting costs
[11/08/2024-09:04:21] [V] [TRT] =============== Computing reformatting costs
[11/08/2024-09:04:21] [V] [TRT] =============== Computing reformatting costs
[11/08/2024-09:04:21] [V] [TRT] *************** Autotuning Reformat: Float(384,1,1,1) -> Float(384,1,384,384) ***************
[11/08/2024-09:04:21] [V] [TRT] *************** Autotuning Reformat: Float(384,1,384,384) -> Float(384,1,1,1) ***************
[11/08/2024-09:04:21] [V] [TRT] =============== Computing reformatting costs
[11/08/2024-09:04:21] [V] [TRT] *************** Autotuning Reformat: Float(3,1,3,3) -> Float(3,1,1,1) ***************
[11/08/2024-09:04:21] [V] [TRT] --------------- Timing Runner: Optimizer Reformat((Unnamed Layer* 40) [Fully Connected]_output -> <out>) (Reformat)
[11/08/2024-09:04:21] [V] [TRT] Tactic: 1002 Time: 0.010336
[11/08/2024-09:04:21] [V] [TRT] Tactic: 0 Time: 0.003116
[11/08/2024-09:04:21] [V] [TRT] Fastest Tactic: 0 Time: 0.003116
[11/08/2024-09:04:21] [V] [TRT] =============== Computing reformatting costs
[11/08/2024-09:04:21] [V] [TRT] =============== Computing reformatting costs
[11/08/2024-09:04:21] [V] [TRT] =============== Computing reformatting costs
[11/08/2024-09:04:21] [V] [TRT] =============== Computing costs for 
[11/08/2024-09:04:21] [V] [TRT] *************** Autotuning format combination: Float(49152,16384,128,1) -> Float(524288,16384,128,1) ***************
[11/08/2024-09:04:21] [V] [TRT] --------------- Timing Runner: /conv1/Conv + /Relu (CudaDepthwiseConvolution)
[11/08/2024-09:04:21] [V] [TRT] CudaDepthwiseConvolution has no valid tactics for this config, skipping
[11/08/2024-09:04:21] [V] [TRT] --------------- Timing Runner: /conv1/Conv + /Relu (FusedConvActConvolution)
[11/08/2024-09:04:21] [V] [TRT] FusedConvActConvolution has no valid tactics for this config, skipping
[11/08/2024-09:04:21] [V] [TRT] --------------- Timing Runner: /conv1/Conv + /Relu (CudnnConvolution)
[11/08/2024-09:04:21] [V] [TRT] CudnnConvolution has no valid tactics for this config, skipping
[11/08/2024-09:04:21] [V] [TRT] --------------- Timing Runner: /conv1/Conv + /Relu (CaskConvolution)
[11/08/2024-09:04:21] [V] [TRT] /conv1/Conv + /Relu Set Tactic Name: maxwell_scudnn_128x32_relu_medium_nn_v1 Tactic: 1062367460111450758
[11/08/2024-09:04:21] [V] [TRT] Tactic: 1062367460111450758 Time: 0.228132
[11/08/2024-09:04:21] [V] [TRT] /conv1/Conv + /Relu Set Tactic Name: maxwell_scudnn_128x32_relu_large_nn_v0 Tactic: 1754984623894446479
[11/08/2024-09:04:21] [V] [TRT] Tactic: 1754984623894446479 Time: 0.194808
[11/08/2024-09:04:21] [V] [TRT] /conv1/Conv + /Relu Set Tactic Name: maxwell_scudnn_128x128_relu_large_nn_v0 Tactic: 3611739942397549984
[11/08/2024-09:04:21] [V] [TRT] Tactic: 3611739942397549984 Time: 0.608512
[11/08/2024-09:04:21] [V] [TRT] /conv1/Conv + /Relu Set Tactic Name: maxwell_scudnn_winograd_128x128_ldg1_ldg4_relu_tile148n_nt_v1 Tactic: 3827454225649558724
[11/08/2024-09:04:21] [V] [TRT] Tactic: 3827454225649558724 Time: 0.4221
[11/08/2024-09:04:21] [V] [TRT] /conv1/Conv + /Relu Set Tactic Name: maxwell_scudnn_128x64_relu_large_nn_v1 Tactic: 4337000649858996379
[11/08/2024-09:04:21] [V] [TRT] Tactic: 4337000649858996379 Time: 0.29918
[11/08/2024-09:04:21] [V] [TRT] /conv1/Conv + /Relu Set Tactic Name: maxwell_scudnn_128x128_relu_medium_nn_v1 Tactic: 4501471010995462441
[11/08/2024-09:04:21] [V] [TRT] Tactic: 4501471010995462441 Time: 0.570268
[11/08/2024-09:04:21] [V] [TRT] /conv1/Conv + /Relu Set Tactic Name: maxwell_scudnn_128x64_relu_small_nn_v1 Tactic: 5137655947464784826
[11/08/2024-09:04:21] [V] [TRT] Tactic: 5137655947464784826 Time: 0.295688
[11/08/2024-09:04:21] [V] [TRT] /conv1/Conv + /Relu Set Tactic Name: maxwell_scudnn_128x128_relu_small_nn_v0 Tactic: 5288347012147084929
[11/08/2024-09:04:21] [V] [TRT] Tactic: 5288347012147084929 Time: 0.601416
[11/08/2024-09:04:21] [V] [TRT] /conv1/Conv + /Relu Set Tactic Name: maxwell_scudnn_winograd_128x128_ldg1_ldg4_relu_tile148m_nt_v1 Tactic: 5921334924264294896
[11/08/2024-09:04:21] [V] [TRT] Tactic: 5921334924264294896 Time: 0.28634
[11/08/2024-09:04:21] [V] [TRT] /conv1/Conv + /Relu Set Tactic Name: maxwell_scudnn_128x64_relu_medium_nn_v1 Tactic: 6645123197870846056
[11/08/2024-09:04:21] [V] [TRT] Tactic: 6645123197870846056 Time: 0.31466
[11/08/2024-09:04:21] [V] [TRT] /conv1/Conv + /Relu Set Tactic Name: maxwell_scudnn_128x32_relu_small_nn_v0 Tactic: 7144526460361122478
[11/08/2024-09:04:21] [V] [TRT] Tactic: 7144526460361122478 Time: 0.196808
[11/08/2024-09:04:21] [V] [TRT] /conv1/Conv + /Relu Set Tactic Name: maxwell_scudnn_winograd_128x128_ldg1_ldg4_relu_tile148t_nt_v1 Tactic: 7852627285308570038
[11/08/2024-09:04:21] [V] [TRT] Tactic: 7852627285308570038 Time: 0.447756
[11/08/2024-09:04:21] [V] [TRT] /conv1/Conv + /Relu Set Tactic Name: maxwell_scudnn_128x128_relu_large_nn_v1 Tactic: -9137461792520977713
[11/08/2024-09:04:21] [V] [TRT] Tactic: -9137461792520977713 Time: 0.575268
[11/08/2024-09:04:21] [V] [TRT] /conv1/Conv + /Relu Set Tactic Name: maxwell_scudnn_winograd_128x128_ldg1_ldg4_relu_tile148n_nt_v0 Tactic: -8776506421218919509
[11/08/2024-09:04:21] [V] [TRT] Tactic: -8776506421218919509 Time: 0.417396
[11/08/2024-09:04:21] [V] [TRT] /conv1/Conv + /Relu Set Tactic Name: maxwell_scudnn_128x128_relu_medium_nn_v0 Tactic: -8262349710178828730
[11/08/2024-09:04:21] [V] [TRT] Tactic: -8262349710178828730 Time: 0.615084
[11/08/2024-09:04:21] [V] [TRT] /conv1/Conv + /Relu Set Tactic Name: maxwell_scudnn_128x64_relu_large_nn_v0 Tactic: -8133971918129952780
[11/08/2024-09:04:21] [V] [TRT] Tactic: -8133971918129952780 Time: 0.301644
[11/08/2024-09:04:21] [V] [TRT] /conv1/Conv + /Relu Set Tactic Name: maxwell_scudnn_128x32_relu_large_nn_v1 Tactic: -6092040395344634144
[11/08/2024-09:04:21] [V] [TRT] Tactic: -6092040395344634144 Time: 0.214216
[11/08/2024-09:04:21] [V] [TRT] /conv1/Conv + /Relu Set Tactic Name: maxwell_scudnn_128x32_relu_medium_nn_v0 Tactic: -4787320710726427159
[11/08/2024-09:04:21] [V] [TRT] Tactic: -4787320710726427159 Time: 0.209532
[11/08/2024-09:04:21] [V] [TRT] /conv1/Conv + /Relu Set Tactic Name: maxwell_scudnn_128x32_relu_small_nn_v1 Tactic: -3456450830548107839
[11/08/2024-09:04:21] [V] [TRT] Tactic: -3456450830548107839 Time: 0.196112
[11/08/2024-09:04:21] [V] [TRT] /conv1/Conv + /Relu Set Tactic Name: maxwell_scudnn_winograd_128x128_ldg1_ldg4_relu_tile148t_nt_v0 Tactic: -2318106587342035239
[11/08/2024-09:04:21] [V] [TRT] Tactic: -2318106587342035239 Time: 0.427176
[11/08/2024-09:04:21] [V] [TRT] /conv1/Conv + /Relu Set Tactic Name: maxwell_scudnn_winograd_128x128_ldg1_ldg4_mobile_relu_tile148t_nt_v0 Tactic: -1343271414618805657
[11/08/2024-09:04:21] [V] [TRT] Tactic: -1343271414618805657 Time: 0.278424
[11/08/2024-09:04:21] [V] [TRT] /conv1/Conv + /Relu Set Tactic Name: maxwell_scudnn_128x64_relu_medium_nn_v0 Tactic: -1218658103698133241
[11/08/2024-09:04:21] [V] [TRT] Tactic: -1218658103698133241 Time: 0.299192
[11/08/2024-09:04:21] [V] [TRT] /conv1/Conv + /Relu Set Tactic Name: maxwell_scudnn_128x64_relu_small_nn_v0 Tactic: -836875257600482091
[11/08/2024-09:04:21] [V] [TRT] Tactic: -836875257600482091 Time: 0.296424
[11/08/2024-09:04:21] [V] [TRT] /conv1/Conv + /Relu Set Tactic Name: maxwell_scudnn_128x128_relu_small_nn_v1 Tactic: -410470605513481746
[11/08/2024-09:04:21] [V] [TRT] Tactic: -410470605513481746 Time: 0.57038
[11/08/2024-09:04:21] [V] [TRT] Fastest Tactic: 1754984623894446479 Time: 0.194808
[11/08/2024-09:04:21] [V] [TRT] >>>>>>>>>>>>>>> Chose Runner Type: CaskConvolution Tactic: 1754984623894446479
[11/08/2024-09:04:21] [V] [TRT] *************** Autotuning format combination: Float(49152,1,384,3) -> Float(524288,1,4096,32) ***************
[11/08/2024-09:04:21] [V] [TRT] --------------- Timing Runner: /conv1/Conv + /Relu (CudnnConvolution)
[11/08/2024-09:04:21] [V] [TRT] CudnnConvolution has no valid tactics for this config, skipping
[11/08/2024-09:04:21] [V] [TRT] --------------- Timing Runner: /conv1/Conv + /Relu (CaskConvolution)
[11/08/2024-09:04:21] [V] [TRT] CaskConvolution has no valid tactics for this config, skipping
[11/08/2024-09:04:21] [V] [TRT] =============== Computing costs for 
[11/08/2024-09:04:21] [V] [TRT] *************** Autotuning format combination: Float(524288,16384,128,1) -> Float(524288,16384,128,1) ***************
[11/08/2024-09:04:21] [V] [TRT] --------------- Timing Runner: /conv2/Conv + /Relu_1 (CudaDepthwiseConvolution)
[11/08/2024-09:04:21] [V] [TRT] CudaDepthwiseConvolution has no valid tactics for this config, skipping
[11/08/2024-09:04:21] [V] [TRT] --------------- Timing Runner: /conv2/Conv + /Relu_1 (FusedConvActConvolution)
[11/08/2024-09:04:21] [V] [TRT] FusedConvActConvolution has no valid tactics for this config, skipping
[11/08/2024-09:04:21] [V] [TRT] --------------- Timing Runner: /conv2/Conv + /Relu_1 (CudnnConvolution)
[11/08/2024-09:04:21] [V] [TRT] CudnnConvolution has no valid tactics for this config, skipping
[11/08/2024-09:04:21] [V] [TRT] --------------- Timing Runner: /conv2/Conv + /Relu_1 (CaskConvolution)
[11/08/2024-09:04:21] [V] [TRT] /conv2/Conv + /Relu_1 Set Tactic Name: maxwell_scudnn_128x32_relu_medium_nn_v1 Tactic: 1062367460111450758
[11/08/2024-09:04:21] [V] [TRT] Tactic: 1062367460111450758 Time: 0.900744
[11/08/2024-09:04:21] [V] [TRT] /conv2/Conv + /Relu_1 Set Tactic Name: maxwell_scudnn_128x32_relu_large_nn_v0 Tactic: 1754984623894446479
[11/08/2024-09:04:21] [V] [TRT] Tactic: 1754984623894446479 Time: 0.99634
[11/08/2024-09:04:21] [V] [TRT] /conv2/Conv + /Relu_1 Set Tactic Name: maxwell_scudnn_128x128_relu_large_nn_v0 Tactic: 3611739942397549984
[11/08/2024-09:04:21] [V] [TRT] Tactic: 3611739942397549984 Time: 2.69984
[11/08/2024-09:04:21] [V] [TRT] /conv2/Conv + /Relu_1 Set Tactic Name: maxwell_scudnn_winograd_128x128_ldg1_ldg4_relu_tile148n_nt_v1 Tactic: 3827454225649558724
[11/08/2024-09:04:21] [V] [TRT] Tactic: 3827454225649558724 Time: 0.802048
[11/08/2024-09:04:21] [V] [TRT] /conv2/Conv + /Relu_1 Set Tactic Name: maxwell_scudnn_128x64_relu_large_nn_v1 Tactic: 4337000649858996379
[11/08/2024-09:04:21] [V] [TRT] Tactic: 4337000649858996379 Time: 2.54808
[11/08/2024-09:04:21] [V] [TRT] /conv2/Conv + /Relu_1 Set Tactic Name: maxwell_scudnn_128x128_relu_medium_nn_v1 Tactic: 4501471010995462441
[11/08/2024-09:04:22] [V] [TRT] Tactic: 4501471010995462441 Time: 5.02165
[11/08/2024-09:04:22] [V] [TRT] /conv2/Conv + /Relu_1 Set Tactic Name: maxwell_scudnn_128x64_relu_small_nn_v1 Tactic: 5137655947464784826
[11/08/2024-09:04:22] [V] [TRT] Tactic: 5137655947464784826 Time: 1.97733
[11/08/2024-09:04:22] [V] [TRT] /conv2/Conv + /Relu_1 Set Tactic Name: maxwell_scudnn_128x128_relu_small_nn_v0 Tactic: 5288347012147084929
[11/08/2024-09:04:22] [V] [TRT] Tactic: 5288347012147084929 Time: 3.40842
[11/08/2024-09:04:22] [V] [TRT] /conv2/Conv + /Relu_1 Set Tactic Name: maxwell_scudnn_winograd_128x128_ldg1_ldg4_relu_tile148m_nt_v1 Tactic: 5921334924264294896
[11/08/2024-09:04:22] [V] [TRT] Tactic: 5921334924264294896 Time: 0.536212
[11/08/2024-09:04:22] [V] [TRT] /conv2/Conv + /Relu_1 Set Tactic Name: maxwell_scudnn_128x64_relu_medium_nn_v1 Tactic: 6645123197870846056
[11/08/2024-09:04:22] [V] [TRT] Tactic: 6645123197870846056 Time: 1.46453
[11/08/2024-09:04:22] [V] [TRT] /conv2/Conv + /Relu_1 Set Tactic Name: maxwell_scudnn_128x32_relu_small_nn_v0 Tactic: 7144526460361122478
[11/08/2024-09:04:22] [V] [TRT] Tactic: 7144526460361122478 Time: 0.955316
[11/08/2024-09:04:22] [V] [TRT] /conv2/Conv + /Relu_1 Set Tactic Name: maxwell_scudnn_winograd_128x128_ldg1_ldg4_relu_tile148t_nt_v1 Tactic: 7852627285308570038
[11/08/2024-09:04:22] [V] [TRT] Tactic: 7852627285308570038 Time: 0.824952
[11/08/2024-09:04:22] [V] [TRT] /conv2/Conv + /Relu_1 Set Tactic Name: maxwell_scudnn_128x128_relu_large_nn_v1 Tactic: -9137461792520977713
[11/08/2024-09:04:22] [V] [TRT] Tactic: -9137461792520977713 Time: 2.71148
[11/08/2024-09:04:22] [V] [TRT] /conv2/Conv + /Relu_1 Set Tactic Name: maxwell_scudnn_winograd_128x128_ldg1_ldg4_relu_tile148n_nt_v0 Tactic: -8776506421218919509
[11/08/2024-09:04:22] [V] [TRT] Tactic: -8776506421218919509 Time: 0.826216
[11/08/2024-09:04:22] [V] [TRT] /conv2/Conv + /Relu_1 Set Tactic Name: maxwell_scudnn_128x128_relu_medium_nn_v0 Tactic: -8262349710178828730
[11/08/2024-09:04:22] [V] [TRT] Tactic: -8262349710178828730 Time: 2.79457
[11/08/2024-09:04:22] [V] [TRT] /conv2/Conv + /Relu_1 Set Tactic Name: maxwell_scudnn_128x64_relu_large_nn_v0 Tactic: -8133971918129952780
[11/08/2024-09:04:22] [V] [TRT] Tactic: -8133971918129952780 Time: 1.56879
[11/08/2024-09:04:22] [V] [TRT] /conv2/Conv + /Relu_1 Set Tactic Name: maxwell_scudnn_128x32_relu_large_nn_v1 Tactic: -6092040395344634144
[11/08/2024-09:04:22] [V] [TRT] Tactic: -6092040395344634144 Time: 0.932996
[11/08/2024-09:04:22] [V] [TRT] /conv2/Conv + /Relu_1 Set Tactic Name: maxwell_scudnn_128x32_relu_medium_nn_v0 Tactic: -4787320710726427159
[11/08/2024-09:04:22] [V] [TRT] Tactic: -4787320710726427159 Time: 0.993668
[11/08/2024-09:04:22] [V] [TRT] /conv2/Conv + /Relu_1 Set Tactic Name: maxwell_scudnn_128x32_relu_small_nn_v1 Tactic: -3456450830548107839
[11/08/2024-09:04:22] [V] [TRT] Tactic: -3456450830548107839 Time: 0.837588
[11/08/2024-09:04:22] [V] [TRT] /conv2/Conv + /Relu_1 Set Tactic Name: maxwell_scudnn_winograd_128x128_ldg1_ldg4_relu_tile148t_nt_v0 Tactic: -2318106587342035239
[11/08/2024-09:04:22] [V] [TRT] Tactic: -2318106587342035239 Time: 1.10047
[11/08/2024-09:04:22] [V] [TRT] /conv2/Conv + /Relu_1 Set Tactic Name: maxwell_scudnn_winograd_128x128_ldg1_ldg4_mobile_relu_tile148t_nt_v0 Tactic: -1343271414618805657
[11/08/2024-09:04:22] [V] [TRT] Tactic: -1343271414618805657 Time: 0.525312
[11/08/2024-09:04:22] [V] [TRT] /conv2/Conv + /Relu_1 Set Tactic Name: maxwell_scudnn_128x64_relu_medium_nn_v0 Tactic: -1218658103698133241
[11/08/2024-09:04:22] [V] [TRT] Tactic: -1218658103698133241 Time: 1.56393
[11/08/2024-09:04:22] [V] [TRT] /conv2/Conv + /Relu_1 Set Tactic Name: maxwell_scudnn_128x64_relu_small_nn_v0 Tactic: -836875257600482091
[11/08/2024-09:04:22] [V] [TRT] Tactic: -836875257600482091 Time: 1.51753
[11/08/2024-09:04:22] [V] [TRT] /conv2/Conv + /Relu_1 Set Tactic Name: maxwell_scudnn_128x128_relu_small_nn_v1 Tactic: -410470605513481746
[11/08/2024-09:04:22] [V] [TRT] Tactic: -410470605513481746 Time: 4.85567
[11/08/2024-09:04:22] [V] [TRT] Fastest Tactic: -1343271414618805657 Time: 0.525312
[11/08/2024-09:04:22] [V] [TRT] >>>>>>>>>>>>>>> Chose Runner Type: CaskConvolution Tactic: -1343271414618805657
[11/08/2024-09:04:22] [V] [TRT] *************** Autotuning format combination: Float(524288,1,4096,32) -> Float(524288,1,4096,32) ***************
[11/08/2024-09:04:22] [V] [TRT] --------------- Timing Runner: /conv2/Conv + /Relu_1 (CudnnConvolution)
[11/08/2024-09:04:22] [V] [TRT] CudnnConvolution has no valid tactics for this config, skipping
[11/08/2024-09:04:23] [V] [TRT] --------------- Timing Runner: /conv2/Conv + /Relu_1 (CaskConvolution)
[11/08/2024-09:04:23] [V] [TRT] /conv2/Conv + /Relu_1 Set Tactic Name: maxwell_scudnn_128x32_sliced1x4_ldg4_relu_exp_small_nhwc_tn_v1 Tactic: -9153228964338181824
[11/08/2024-09:04:23] [V] [TRT] Tactic: -9153228964338181824 Time: 2.12038
[11/08/2024-09:04:23] [V] [TRT] /conv2/Conv + /Relu_1 Set Tactic Name: maxwell_scudnn_128x64_sliced1x2_ldg4_relu_exp_small_nhwc_tn_v1 Tactic: -7394439838318485025
[11/08/2024-09:04:23] [V] [TRT] Tactic: -7394439838318485025 Time: 1.89313
[11/08/2024-09:04:23] [V] [TRT] Fastest Tactic: -7394439838318485025 Time: 1.89313
[11/08/2024-09:04:23] [V] [TRT] >>>>>>>>>>>>>>> Chose Runner Type: CaskConvolution Tactic: -7394439838318485025
[11/08/2024-09:04:23] [V] [TRT] =============== Computing costs for 
[11/08/2024-09:04:23] [V] [TRT] *************** Autotuning format combination: Float(524288,16384,128,1) -> Float(131072,4096,64,1) ***************
[11/08/2024-09:04:23] [V] [TRT] --------------- Timing Runner: /pool/MaxPool (TiledPooling)
[11/08/2024-09:04:23] [V] [TRT] Tactic: 5505281 Time: 0.178148
[11/08/2024-09:04:23] [V] [TRT] Tactic: 5570817 Time: 0.114388
[11/08/2024-09:04:23] [V] [TRT] Tactic: 5636353 Time: 0.094192
[11/08/2024-09:04:23] [V] [TRT] Tactic: 5701889 Time: 0.080892
[11/08/2024-09:04:23] [V] [TRT] Tactic: 5767425 Time: 0.087888
[11/08/2024-09:04:23] [V] [TRT] Tactic: 5832961 Time: 0.081516
[11/08/2024-09:04:23] [V] [TRT] Tactic: 5898497 Time: 0.090668
[11/08/2024-09:04:23] [V] [TRT] Tactic: 5964033 Time: 0.084692
[11/08/2024-09:04:23] [V] [TRT] Tactic: 6029569 Time: 0.177832
[11/08/2024-09:04:23] [V] [TRT] Tactic: 6095105 Time: 0.109604
[11/08/2024-09:04:23] [V] [TRT] Tactic: 6160641 Time: 0.096952
[11/08/2024-09:04:23] [V] [TRT] Tactic: 6226177 Time: 0.081808
[11/08/2024-09:04:23] [V] [TRT] Tactic: 6291713 Time: 0.089944
[11/08/2024-09:04:23] [V] [TRT] Tactic: 6357249 Time: 0.086884
[11/08/2024-09:04:23] [V] [TRT] Tactic: 6422785 Time: 0.089312
[11/08/2024-09:04:23] [V] [TRT] Tactic: 6488321 Time: 0.08732
[11/08/2024-09:04:23] [V] [TRT] Fastest Tactic: 5701889 Time: 0.080892
[11/08/2024-09:04:23] [V] [TRT] --------------- Timing Runner: /pool/MaxPool (CudnnPooling)
[11/08/2024-09:04:23] [V] [TRT] CudnnPooling has no valid tactics for this config, skipping
[11/08/2024-09:04:23] [V] [TRT] >>>>>>>>>>>>>>> Chose Runner Type: TiledPooling Tactic: 5701889
[11/08/2024-09:04:23] [V] [TRT] =============== Computing costs for 
[11/08/2024-09:04:23] [V] [TRT] *************** Autotuning format combination: Float(131072,4096,64,1) -> Float(262144,4096,64,1) ***************
[11/08/2024-09:04:23] [V] [TRT] --------------- Timing Runner: /conv3/Conv + /Relu_2 (CudaDepthwiseConvolution)
[11/08/2024-09:04:23] [V] [TRT] CudaDepthwiseConvolution has no valid tactics for this config, skipping
[11/08/2024-09:04:23] [V] [TRT] --------------- Timing Runner: /conv3/Conv + /Relu_2 (FusedConvActConvolution)
[11/08/2024-09:04:23] [V] [TRT] Tactic: 524287 Time: 0.55792
[11/08/2024-09:04:23] [V] [TRT] Tactic: 720895 Time: 0.54036
[11/08/2024-09:04:23] [V] [TRT] Tactic: 983039 Time: 0.535276
[11/08/2024-09:04:23] [V] [TRT] Tactic: 1048575 Time: 0.570676
[11/08/2024-09:04:23] [V] [TRT] Tactic: 1703935 Time: 0.550416
[11/08/2024-09:04:24] [V] [TRT] Tactic: 1769471 Time: 0.663096
[11/08/2024-09:04:24] [V] [TRT] Tactic: 1966079 Time: 0.51972
[11/08/2024-09:04:24] [V] [TRT] Tactic: 2031615 Time: 0.560212
[11/08/2024-09:04:24] [V] [TRT] Tactic: 2228223 Time: 0.55058
[11/08/2024-09:04:24] [V] [TRT] Tactic: 2424831 Time: 0.595428
[11/08/2024-09:04:24] [V] [TRT] Tactic: 2621439 Time: 0.6685
[11/08/2024-09:04:24] [V] [TRT] Tactic: 2752511 Time: 0.565684
[11/08/2024-09:04:24] [V] [TRT] Tactic: 2818047 Time: 1.36034
[11/08/2024-09:04:24] [V] [TRT] Tactic: 2883583 Time: 0.83504
[11/08/2024-09:04:24] [V] [TRT] Tactic: 3014655 Time: 0.560768
[11/08/2024-09:04:24] [V] [TRT] Tactic: 3145727 Time: 0.534764
[11/08/2024-09:04:25] [V] [TRT] Tactic: 3473407 Time: 0.858276
[11/08/2024-09:04:25] [V] [TRT] Tactic: 3604479 Time: 0.510584
[11/08/2024-09:04:25] [V] [TRT] Tactic: 3735551 Time: 0.76576
[11/08/2024-09:04:25] [V] [TRT] Tactic: 4390911 Time: 0.576844
[11/08/2024-09:04:25] [V] [TRT] Tactic: 5046271 Time: 0.5824
[11/08/2024-09:04:25] [V] [TRT] Tactic: 5963775 Time: 0.533528
[11/08/2024-09:04:25] [V] [TRT] Tactic: 6160383 Time: 0.541904
[11/08/2024-09:04:25] [V] [TRT] Tactic: 6488063 Time: 0.610176
[11/08/2024-09:04:25] [V] [TRT] Tactic: 6881279 Time: 0.59754
[11/08/2024-09:04:25] [V] [TRT] Tactic: 7274495 Time: 0.719968
[11/08/2024-09:04:25] [V] [TRT] Tactic: 7864319 Time: 0.697192
[11/08/2024-09:04:25] [V] [TRT] Tactic: 7995391 Time: 0.489548
[11/08/2024-09:04:25] [V] [TRT] Tactic: 8585215 Time: 0.562768
[11/08/2024-09:04:25] [V] [TRT] Tactic: 8847359 Time: 0.719972
[11/08/2024-09:04:26] [V] [TRT] Tactic: 8978431 Time: 0.573696
[11/08/2024-09:04:26] [V] [TRT] Tactic: 9043967 Time: 0.609112
[11/08/2024-09:04:26] [V] [TRT] Tactic: 9175039 Time: 0.496132
[11/08/2024-09:04:26] [V] [TRT] Tactic: 9502719 Time: 0.553188
[11/08/2024-09:04:26] [V] [TRT] Tactic: 9830399 Time: 0.798028
[11/08/2024-09:04:26] [V] [TRT] Tactic: 9961471 Time: 0.600276
[11/08/2024-09:04:26] [V] [TRT] Tactic: 10027007 Time: 0.555388
[11/08/2024-09:04:26] [V] [TRT] Tactic: 10092543 Time: 0.580468
[11/08/2024-09:04:26] [V] [TRT] Tactic: 10289151 Time: 0.506624
[11/08/2024-09:04:26] [V] [TRT] Tactic: 10485759 Time: 0.531756
[11/08/2024-09:04:26] [V] [TRT] Tactic: 10682367 Time: 0.58604
[11/08/2024-09:04:26] [V] [TRT] Tactic: 10813439 Time: 0.447344
[11/08/2024-09:04:26] [V] [TRT] Fastest Tactic: 10813439 Time: 0.447344
[11/08/2024-09:04:26] [V] [TRT] --------------- Timing Runner: /conv3/Conv + /Relu_2 (CudnnConvolution)
[11/08/2024-09:04:26] [V] [TRT] CudnnConvolution has no valid tactics for this config, skipping
[11/08/2024-09:04:26] [V] [TRT] --------------- Timing Runner: /conv3/Conv + /Relu_2 (CaskConvolution)
[11/08/2024-09:04:26] [V] [TRT] /conv3/Conv + /Relu_2 Set Tactic Name: maxwell_scudnn_128x32_relu_medium_nn_v1 Tactic: 1062367460111450758
[11/08/2024-09:04:26] [V] [TRT] Tactic: 1062367460111450758 Time: 0.47242
[11/08/2024-09:04:26] [V] [TRT] /conv3/Conv + /Relu_2 Set Tactic Name: maxwell_scudnn_128x32_relu_large_nn_v0 Tactic: 1754984623894446479
[11/08/2024-09:04:26] [V] [TRT] Tactic: 1754984623894446479 Time: 0.522592
[11/08/2024-09:04:26] [V] [TRT] /conv3/Conv + /Relu_2 Set Tactic Name: maxwell_scudnn_128x128_relu_large_nn_v0 Tactic: 3611739942397549984
[11/08/2024-09:04:26] [V] [TRT] Tactic: 3611739942397549984 Time: 0.698948
[11/08/2024-09:04:26] [V] [TRT] /conv3/Conv + /Relu_2 Set Tactic Name: maxwell_scudnn_winograd_128x128_ldg1_ldg4_relu_tile148n_nt_v1 Tactic: 3827454225649558724
[11/08/2024-09:04:26] [V] [TRT] Tactic: 3827454225649558724 Time: 0.408996
[11/08/2024-09:04:26] [V] [TRT] /conv3/Conv + /Relu_2 Set Tactic Name: maxwell_scudnn_128x64_relu_large_nn_v1 Tactic: 4337000649858996379
[11/08/2024-09:04:26] [V] [TRT] Tactic: 4337000649858996379 Time: 0.382884
[11/08/2024-09:04:26] [V] [TRT] /conv3/Conv + /Relu_2 Set Tactic Name: maxwell_scudnn_128x128_relu_medium_nn_v1 Tactic: 4501471010995462441
[11/08/2024-09:04:27] [V] [TRT] Tactic: 4501471010995462441 Time: 0.685832
[11/08/2024-09:04:27] [V] [TRT] /conv3/Conv + /Relu_2 Set Tactic Name: maxwell_scudnn_128x64_relu_small_nn_v1 Tactic: 5137655947464784826
[11/08/2024-09:04:27] [V] [TRT] Tactic: 5137655947464784826 Time: 0.367096
[11/08/2024-09:04:27] [V] [TRT] /conv3/Conv + /Relu_2 Set Tactic Name: maxwell_scudnn_128x128_relu_small_nn_v0 Tactic: 5288347012147084929
[11/08/2024-09:04:27] [V] [TRT] Tactic: 5288347012147084929 Time: 0.668716
[11/08/2024-09:04:27] [V] [TRT] /conv3/Conv + /Relu_2 Set Tactic Name: maxwell_scudnn_winograd_128x128_ldg1_ldg4_relu_tile148m_nt_v1 Tactic: 5921334924264294896
[11/08/2024-09:04:27] [V] [TRT] Tactic: 5921334924264294896 Time: 0.265664
[11/08/2024-09:04:27] [V] [TRT] /conv3/Conv + /Relu_2 Set Tactic Name: maxwell_scudnn_128x64_relu_medium_nn_v1 Tactic: 6645123197870846056
[11/08/2024-09:04:27] [V] [TRT] Tactic: 6645123197870846056 Time: 0.373276
[11/08/2024-09:04:27] [V] [TRT] /conv3/Conv + /Relu_2 Set Tactic Name: maxwell_scudnn_128x32_relu_small_nn_v0 Tactic: 7144526460361122478
[11/08/2024-09:04:27] [V] [TRT] Tactic: 7144526460361122478 Time: 0.491616
[11/08/2024-09:04:27] [V] [TRT] /conv3/Conv + /Relu_2 Set Tactic Name: maxwell_scudnn_winograd_128x128_ldg1_ldg4_relu_tile148t_nt_v1 Tactic: 7852627285308570038
[11/08/2024-09:04:27] [V] [TRT] Tactic: 7852627285308570038 Time: 0.416688
[11/08/2024-09:04:27] [V] [TRT] /conv3/Conv + /Relu_2 Set Tactic Name: maxwell_scudnn_128x128_relu_large_nn_v1 Tactic: -9137461792520977713
[11/08/2024-09:04:27] [V] [TRT] Tactic: -9137461792520977713 Time: 0.685576
[11/08/2024-09:04:27] [V] [TRT] /conv3/Conv + /Relu_2 Set Tactic Name: maxwell_scudnn_winograd_128x128_ldg1_ldg4_relu_tile148n_nt_v0 Tactic: -8776506421218919509
[11/08/2024-09:04:27] [V] [TRT] Tactic: -8776506421218919509 Time: 0.390592
[11/08/2024-09:04:27] [V] [TRT] /conv3/Conv + /Relu_2 Set Tactic Name: maxwell_scudnn_128x128_relu_medium_nn_v0 Tactic: -8262349710178828730
[11/08/2024-09:04:27] [V] [TRT] Tactic: -8262349710178828730 Time: 0.682824
[11/08/2024-09:04:27] [V] [TRT] /conv3/Conv + /Relu_2 Set Tactic Name: maxwell_scudnn_128x64_relu_large_nn_v0 Tactic: -8133971918129952780
[11/08/2024-09:04:27] [V] [TRT] Tactic: -8133971918129952780 Time: 0.403868
[11/08/2024-09:04:27] [V] [TRT] /conv3/Conv + /Relu_2 Set Tactic Name: maxwell_scudnn_128x32_relu_large_nn_v1 Tactic: -6092040395344634144
[11/08/2024-09:04:27] [V] [TRT] Tactic: -6092040395344634144 Time: 0.487836
[11/08/2024-09:04:27] [V] [TRT] /conv3/Conv + /Relu_2 Set Tactic Name: maxwell_scudnn_128x32_relu_medium_nn_v0 Tactic: -4787320710726427159
[11/08/2024-09:04:27] [V] [TRT] Tactic: -4787320710726427159 Time: 0.520464
[11/08/2024-09:04:27] [V] [TRT] /conv3/Conv + /Relu_2 Set Tactic Name: maxwell_scudnn_128x32_relu_small_nn_v1 Tactic: -3456450830548107839
[11/08/2024-09:04:27] [V] [TRT] Tactic: -3456450830548107839 Time: 0.430628
[11/08/2024-09:04:27] [V] [TRT] /conv3/Conv + /Relu_2 Set Tactic Name: maxwell_scudnn_winograd_128x128_ldg1_ldg4_relu_tile148t_nt_v0 Tactic: -2318106587342035239
[11/08/2024-09:04:27] [V] [TRT] Tactic: -2318106587342035239 Time: 0.40816
[11/08/2024-09:04:27] [V] [TRT] /conv3/Conv + /Relu_2 Set Tactic Name: maxwell_scudnn_winograd_128x128_ldg1_ldg4_mobile_relu_tile148t_nt_v0 Tactic: -1343271414618805657
[11/08/2024-09:04:27] [V] [TRT] Tactic: -1343271414618805657 Time: 0.25904
[11/08/2024-09:04:27] [V] [TRT] /conv3/Conv + /Relu_2 Set Tactic Name: maxwell_scudnn_128x64_relu_medium_nn_v0 Tactic: -1218658103698133241
[11/08/2024-09:04:27] [V] [TRT] Tactic: -1218658103698133241 Time: 0.401488
[11/08/2024-09:04:27] [V] [TRT] /conv3/Conv + /Relu_2 Set Tactic Name: maxwell_scudnn_128x64_relu_small_nn_v0 Tactic: -836875257600482091
[11/08/2024-09:04:27] [V] [TRT] Tactic: -836875257600482091 Time: 0.392468
[11/08/2024-09:04:27] [V] [TRT] /conv3/Conv + /Relu_2 Set Tactic Name: maxwell_scudnn_128x128_relu_small_nn_v1 Tactic: -410470605513481746
[11/08/2024-09:04:27] [V] [TRT] Tactic: -410470605513481746 Time: 0.662876
[11/08/2024-09:04:27] [V] [TRT] Fastest Tactic: -1343271414618805657 Time: 0.25904
[11/08/2024-09:04:27] [V] [TRT] >>>>>>>>>>>>>>> Chose Runner Type: CaskConvolution Tactic: -1343271414618805657
[11/08/2024-09:04:27] [V] [TRT] *************** Autotuning format combination: Float(131072,1,2048,32) -> Float(262144,1,4096,64) ***************
[11/08/2024-09:04:27] [V] [TRT] --------------- Timing Runner: /conv3/Conv + /Relu_2 (CudnnConvolution)
[11/08/2024-09:04:27] [V] [TRT] CudnnConvolution has no valid tactics for this config, skipping
[11/08/2024-09:04:27] [V] [TRT] --------------- Timing Runner: /conv3/Conv + /Relu_2 (CaskConvolution)
[11/08/2024-09:04:27] [V] [TRT] /conv3/Conv + /Relu_2 Set Tactic Name: maxwell_scudnn_128x32_sliced1x4_ldg4_relu_exp_small_nhwc_tn_v1 Tactic: -9153228964338181824
[11/08/2024-09:04:27] [V] [TRT] Tactic: -9153228964338181824 Time: 0.570288
[11/08/2024-09:04:27] [V] [TRT] /conv3/Conv + /Relu_2 Set Tactic Name: maxwell_scudnn_128x64_sliced1x2_ldg4_relu_exp_small_nhwc_tn_v1 Tactic: -7394439838318485025
[11/08/2024-09:04:27] [V] [TRT] Tactic: -7394439838318485025 Time: 0.3551
[11/08/2024-09:04:27] [V] [TRT] Fastest Tactic: -7394439838318485025 Time: 0.3551
[11/08/2024-09:04:27] [V] [TRT] >>>>>>>>>>>>>>> Chose Runner Type: CaskConvolution Tactic: -7394439838318485025
[11/08/2024-09:04:27] [V] [TRT] =============== Computing costs for 
[11/08/2024-09:04:27] [V] [TRT] *************** Autotuning format combination: Float(262144,4096,64,1) -> Float(65536,1024,32,1) ***************
[11/08/2024-09:04:27] [V] [TRT] --------------- Timing Runner: /pool_1/MaxPool (TiledPooling)
[11/08/2024-09:04:27] [V] [TRT] Tactic: 5505281 Time: 0.09084
[11/08/2024-09:04:27] [V] [TRT] Tactic: 5570817 Time: 0.065272
[11/08/2024-09:04:27] [V] [TRT] Tactic: 5636353 Time: 0.053364
[11/08/2024-09:04:27] [V] [TRT] Tactic: 5701889 Time: 0.050712
[11/08/2024-09:04:27] [V] [TRT] Tactic: 5767425 Time: 0.054848
[11/08/2024-09:04:27] [V] [TRT] Tactic: 5832961 Time: 0.049788
[11/08/2024-09:04:27] [V] [TRT] Tactic: 5898497 Time: 0.053528
[11/08/2024-09:04:27] [V] [TRT] Tactic: 5964033 Time: 0.060532
[11/08/2024-09:04:27] [V] [TRT] Tactic: 6029569 Time: 0.090668
[11/08/2024-09:04:27] [V] [TRT] Tactic: 6095105 Time: 0.059648
[11/08/2024-09:04:27] [V] [TRT] Tactic: 6160641 Time: 0.062804
[11/08/2024-09:04:27] [V] [TRT] Tactic: 6226177 Time: 0.062568
[11/08/2024-09:04:27] [V] [TRT] Tactic: 6291713 Time: 0.060668
[11/08/2024-09:04:27] [V] [TRT] Tactic: 6357249 Time: 0.066716
[11/08/2024-09:04:28] [V] [TRT] Tactic: 6422785 Time: 0.054672
[11/08/2024-09:04:28] [V] [TRT] Tactic: 6488321 Time: 0.04918
[11/08/2024-09:04:28] [V] [TRT] Fastest Tactic: 6488321 Time: 0.04918
[11/08/2024-09:04:28] [V] [TRT] --------------- Timing Runner: /pool_1/MaxPool (CudnnPooling)
[11/08/2024-09:04:28] [V] [TRT] CudnnPooling has no valid tactics for this config, skipping
[11/08/2024-09:04:28] [V] [TRT] >>>>>>>>>>>>>>> Chose Runner Type: TiledPooling Tactic: 6488321
[11/08/2024-09:04:28] [V] [TRT] =============== Computing costs for 
[11/08/2024-09:04:28] [V] [TRT] *************** Autotuning format combination: Float(65536,1024,32,1) -> Float(98304,1024,32,1) ***************
[11/08/2024-09:04:28] [V] [TRT] --------------- Timing Runner: /conv4/Conv + /Relu_3 (CudaDepthwiseConvolution)
[11/08/2024-09:04:28] [V] [TRT] CudaDepthwiseConvolution has no valid tactics for this config, skipping
[11/08/2024-09:04:28] [V] [TRT] --------------- Timing Runner: /conv4/Conv + /Relu_3 (FusedConvActConvolution)
[11/08/2024-09:04:28] [V] [TRT] Tactic: 524287 Time: 0.365616
[11/08/2024-09:04:28] [V] [TRT] Tactic: 720895 Time: 0.453796
[11/08/2024-09:04:28] [V] [TRT] Tactic: 983039 Time: 0.401496
[11/08/2024-09:04:28] [V] [TRT] Tactic: 1048575 Time: 0.344124
[11/08/2024-09:04:28] [V] [TRT] Tactic: 1703935 Time: 0.327756
[11/08/2024-09:04:28] [V] [TRT] Tactic: 1769471 Time: 0.502424
[11/08/2024-09:04:28] [V] [TRT] Tactic: 1966079 Time: 0.380304
[11/08/2024-09:04:28] [V] [TRT] Tactic: 2031615 Time: 0.466672
[11/08/2024-09:04:28] [V] [TRT] Tactic: 2228223 Time: 0.36494
[11/08/2024-09:04:28] [V] [TRT] Tactic: 2424831 Time: 0.3958
[11/08/2024-09:04:28] [V] [TRT] Tactic: 2621439 Time: 0.396164
[11/08/2024-09:04:28] [V] [TRT] Tactic: 2752511 Time: 0.469944
[11/08/2024-09:04:28] [V] [TRT] Tactic: 2818047 Time: 0.733248
[11/08/2024-09:04:28] [V] [TRT] Tactic: 2883583 Time: 0.457872
[11/08/2024-09:04:28] [V] [TRT] Tactic: 3014655 Time: 0.327096
[11/08/2024-09:04:28] [V] [TRT] Tactic: 3145727 Time: 0.46168
[11/08/2024-09:04:29] [V] [TRT] Tactic: 3473407 Time: 0.448312
[11/08/2024-09:04:29] [V] [TRT] Tactic: 3604479 Time: 0.306788
[11/08/2024-09:04:29] [V] [TRT] Tactic: 3735551 Time: 0.436948
[11/08/2024-09:04:29] [V] [TRT] Tactic: 4390911 Time: 0.49612
[11/08/2024-09:04:29] [V] [TRT] Tactic: 5046271 Time: 0.33876
[11/08/2024-09:04:29] [V] [TRT] Tactic: 5963775 Time: 0.422552
[11/08/2024-09:04:29] [V] [TRT] Tactic: 6160383 Time: 0.352216
[11/08/2024-09:04:29] [V] [TRT] Tactic: 6488063 Time: 0.373944
[11/08/2024-09:04:29] [V] [TRT] Tactic: 6881279 Time: 0.458372
[11/08/2024-09:04:29] [V] [TRT] Tactic: 7274495 Time: 0.51502
[11/08/2024-09:04:29] [V] [TRT] Tactic: 7864319 Time: 0.430756
[11/08/2024-09:04:29] [V] [TRT] Tactic: 7995391 Time: 0.382132
[11/08/2024-09:04:29] [V] [TRT] Tactic: 8585215 Time: 0.392136
[11/08/2024-09:04:29] [V] [TRT] Tactic: 8847359 Time: 0.415168
[11/08/2024-09:04:29] [V] [TRT] Tactic: 8978431 Time: 0.433264
[11/08/2024-09:04:30] [V] [TRT] Tactic: 9043967 Time: 0.535004
[11/08/2024-09:04:30] [V] [TRT] Tactic: 9175039 Time: 0.30922
[11/08/2024-09:04:30] [V] [TRT] Tactic: 9502719 Time: 0.492396
[11/08/2024-09:04:30] [V] [TRT] Tactic: 9830399 Time: 0.40368
[11/08/2024-09:04:30] [V] [TRT] Tactic: 9961471 Time: 0.361284
[11/08/2024-09:04:30] [V] [TRT] Tactic: 10027007 Time: 0.347944
[11/08/2024-09:04:30] [V] [TRT] Tactic: 10092543 Time: 0.503392
[11/08/2024-09:04:30] [V] [TRT] Tactic: 10289151 Time: 0.3823
[11/08/2024-09:04:30] [V] [TRT] Tactic: 10485759 Time: 0.34316
[11/08/2024-09:04:30] [V] [TRT] Tactic: 10682367 Time: 0.36638
[11/08/2024-09:04:30] [V] [TRT] Tactic: 10813439 Time: 0.374416
[11/08/2024-09:04:30] [V] [TRT] Fastest Tactic: 3604479 Time: 0.306788
[11/08/2024-09:04:30] [V] [TRT] --------------- Timing Runner: /conv4/Conv + /Relu_3 (CudnnConvolution)
[11/08/2024-09:04:30] [V] [TRT] CudnnConvolution has no valid tactics for this config, skipping
[11/08/2024-09:04:30] [V] [TRT] --------------- Timing Runner: /conv4/Conv + /Relu_3 (CaskConvolution)
[11/08/2024-09:04:30] [V] [TRT] /conv4/Conv + /Relu_3 Set Tactic Name: maxwell_scudnn_128x32_relu_medium_nn_v1 Tactic: 1062367460111450758
[11/08/2024-09:04:30] [V] [TRT] Tactic: 1062367460111450758 Time: 0.32818
[11/08/2024-09:04:30] [V] [TRT] /conv4/Conv + /Relu_3 Set Tactic Name: maxwell_scudnn_128x32_relu_large_nn_v0 Tactic: 1754984623894446479
[11/08/2024-09:04:30] [V] [TRT] Tactic: 1754984623894446479 Time: 0.434316
[11/08/2024-09:04:30] [V] [TRT] /conv4/Conv + /Relu_3 Set Tactic Name: maxwell_scudnn_128x128_relu_large_nn_v0 Tactic: 3611739942397549984
[11/08/2024-09:04:30] [V] [TRT] Tactic: 3611739942397549984 Time: 0.347932
[11/08/2024-09:04:30] [V] [TRT] /conv4/Conv + /Relu_3 Set Tactic Name: maxwell_scudnn_winograd_128x128_ldg1_ldg4_relu_tile148n_nt_v1 Tactic: 3827454225649558724
[11/08/2024-09:04:30] [V] [TRT] Tactic: 3827454225649558724 Time: 0.252024
[11/08/2024-09:04:30] [V] [TRT] /conv4/Conv + /Relu_3 Set Tactic Name: maxwell_scudnn_128x64_relu_large_nn_v1 Tactic: 4337000649858996379
[11/08/2024-09:04:30] [V] [TRT] Tactic: 4337000649858996379 Time: 0.360592
[11/08/2024-09:04:30] [V] [TRT] /conv4/Conv + /Relu_3 Set Tactic Name: maxwell_scudnn_128x128_relu_medium_nn_v1 Tactic: 4501471010995462441
[11/08/2024-09:04:31] [V] [TRT] Tactic: 4501471010995462441 Time: 0.342608
[11/08/2024-09:04:31] [V] [TRT] /conv4/Conv + /Relu_3 Set Tactic Name: maxwell_scudnn_128x64_relu_small_nn_v1 Tactic: 5137655947464784826
[11/08/2024-09:04:31] [V] [TRT] Tactic: 5137655947464784826 Time: 0.34226
[11/08/2024-09:04:31] [V] [TRT] /conv4/Conv + /Relu_3 Set Tactic Name: maxwell_scudnn_128x128_relu_small_nn_v0 Tactic: 5288347012147084929
[11/08/2024-09:04:31] [V] [TRT] Tactic: 5288347012147084929 Time: 0.31904
[11/08/2024-09:04:31] [V] [TRT] /conv4/Conv + /Relu_3 Set Tactic Name: maxwell_scudnn_winograd_128x128_ldg1_ldg4_relu_tile148m_nt_v1 Tactic: 5921334924264294896
[11/08/2024-09:04:31] [V] [TRT] Tactic: 5921334924264294896 Time: 0.172928
[11/08/2024-09:04:31] [V] [TRT] /conv4/Conv + /Relu_3 Set Tactic Name: maxwell_scudnn_128x64_relu_medium_nn_v1 Tactic: 6645123197870846056
[11/08/2024-09:04:31] [V] [TRT] Tactic: 6645123197870846056 Time: 0.347428
[11/08/2024-09:04:31] [V] [TRT] /conv4/Conv + /Relu_3 Set Tactic Name: maxwell_scudnn_128x32_relu_small_nn_v0 Tactic: 7144526460361122478
[11/08/2024-09:04:31] [V] [TRT] Tactic: 7144526460361122478 Time: 0.378828
[11/08/2024-09:04:31] [V] [TRT] /conv4/Conv + /Relu_3 Set Tactic Name: maxwell_scudnn_winograd_128x128_ldg1_ldg4_relu_tile148t_nt_v1 Tactic: 7852627285308570038
[11/08/2024-09:04:31] [V] [TRT] Tactic: 7852627285308570038 Time: 0.22836
[11/08/2024-09:04:31] [V] [TRT] /conv4/Conv + /Relu_3 Set Tactic Name: maxwell_scudnn_128x128_relu_large_nn_v1 Tactic: -9137461792520977713
[11/08/2024-09:04:31] [V] [TRT] Tactic: -9137461792520977713 Time: 0.33038
[11/08/2024-09:04:31] [V] [TRT] /conv4/Conv + /Relu_3 Set Tactic Name: maxwell_scudnn_winograd_128x128_ldg1_ldg4_relu_tile148n_nt_v0 Tactic: -8776506421218919509
[11/08/2024-09:04:31] [V] [TRT] Tactic: -8776506421218919509 Time: 0.244496
[11/08/2024-09:04:31] [V] [TRT] /conv4/Conv + /Relu_3 Set Tactic Name: maxwell_scudnn_128x128_relu_medium_nn_v0 Tactic: -8262349710178828730
[11/08/2024-09:04:31] [V] [TRT] Tactic: -8262349710178828730 Time: 0.328456
[11/08/2024-09:04:31] [V] [TRT] /conv4/Conv + /Relu_3 Set Tactic Name: maxwell_scudnn_128x64_relu_large_nn_v0 Tactic: -8133971918129952780
[11/08/2024-09:04:31] [V] [TRT] Tactic: -8133971918129952780 Time: 0.375816
[11/08/2024-09:04:31] [V] [TRT] /conv4/Conv + /Relu_3 Set Tactic Name: maxwell_scudnn_128x32_relu_large_nn_v1 Tactic: -6092040395344634144
[11/08/2024-09:04:31] [V] [TRT] Tactic: -6092040395344634144 Time: 0.340032
[11/08/2024-09:04:31] [V] [TRT] /conv4/Conv + /Relu_3 Set Tactic Name: maxwell_scudnn_128x32_relu_medium_nn_v0 Tactic: -4787320710726427159
[11/08/2024-09:04:31] [V] [TRT] Tactic: -4787320710726427159 Time: 0.403428
[11/08/2024-09:04:31] [V] [TRT] /conv4/Conv + /Relu_3 Set Tactic Name: maxwell_scudnn_128x32_relu_small_nn_v1 Tactic: -3456450830548107839
[11/08/2024-09:04:31] [V] [TRT] Tactic: -3456450830548107839 Time: 0.296636
[11/08/2024-09:04:31] [V] [TRT] /conv4/Conv + /Relu_3 Set Tactic Name: maxwell_scudnn_winograd_128x128_ldg1_ldg4_relu_tile148t_nt_v0 Tactic: -2318106587342035239
[11/08/2024-09:04:31] [V] [TRT] Tactic: -2318106587342035239 Time: 0.227
[11/08/2024-09:04:31] [V] [TRT] /conv4/Conv + /Relu_3 Set Tactic Name: maxwell_scudnn_winograd_128x128_ldg1_ldg4_mobile_relu_tile148t_nt_v0 Tactic: -1343271414618805657
[11/08/2024-09:04:31] [V] [TRT] Tactic: -1343271414618805657 Time: 0.166868
[11/08/2024-09:04:31] [V] [TRT] /conv4/Conv + /Relu_3 Set Tactic Name: maxwell_scudnn_128x64_relu_medium_nn_v0 Tactic: -1218658103698133241
[11/08/2024-09:04:31] [V] [TRT] Tactic: -1218658103698133241 Time: 0.370552
[11/08/2024-09:04:31] [V] [TRT] /conv4/Conv + /Relu_3 Set Tactic Name: maxwell_scudnn_128x64_relu_small_nn_v0 Tactic: -836875257600482091
[11/08/2024-09:04:31] [V] [TRT] Tactic: -836875257600482091 Time: 0.354408
[11/08/2024-09:04:31] [V] [TRT] /conv4/Conv + /Relu_3 Set Tactic Name: maxwell_scudnn_128x128_relu_small_nn_v1 Tactic: -410470605513481746
[11/08/2024-09:04:31] [V] [TRT] Tactic: -410470605513481746 Time: 0.318348
[11/08/2024-09:04:31] [V] [TRT] Fastest Tactic: -1343271414618805657 Time: 0.166868
[11/08/2024-09:04:31] [V] [TRT] >>>>>>>>>>>>>>> Chose Runner Type: CaskConvolution Tactic: -1343271414618805657
[11/08/2024-09:04:31] [V] [TRT] *************** Autotuning format combination: Float(65536,1,2048,64) -> Float(98304,1,3072,96) ***************
[11/08/2024-09:04:31] [V] [TRT] --------------- Timing Runner: /conv4/Conv + /Relu_3 (CudnnConvolution)
[11/08/2024-09:04:31] [V] [TRT] CudnnConvolution has no valid tactics for this config, skipping
[11/08/2024-09:04:31] [V] [TRT] --------------- Timing Runner: /conv4/Conv + /Relu_3 (CaskConvolution)
[11/08/2024-09:04:31] [V] [TRT] /conv4/Conv + /Relu_3 Set Tactic Name: maxwell_scudnn_128x32_sliced1x4_ldg4_relu_exp_small_nhwc_tn_v1 Tactic: -9153228964338181824
[11/08/2024-09:04:31] [V] [TRT] Tactic: -9153228964338181824 Time: 0.347248
[11/08/2024-09:04:31] [V] [TRT] /conv4/Conv + /Relu_3 Set Tactic Name: maxwell_scudnn_128x64_sliced1x2_ldg4_relu_exp_small_nhwc_tn_v1 Tactic: -7394439838318485025
[11/08/2024-09:04:31] [V] [TRT] Tactic: -7394439838318485025 Time: 0.32452
[11/08/2024-09:04:31] [V] [TRT] Fastest Tactic: -7394439838318485025 Time: 0.32452
[11/08/2024-09:04:31] [V] [TRT] >>>>>>>>>>>>>>> Chose Runner Type: CaskConvolution Tactic: -7394439838318485025
[11/08/2024-09:04:31] [V] [TRT] =============== Computing costs for 
[11/08/2024-09:04:31] [V] [TRT] *************** Autotuning format combination: Float(98304,1024,32,1) -> Float(24576,256,16,1) ***************
[11/08/2024-09:04:31] [V] [TRT] --------------- Timing Runner: /pool_2/MaxPool (TiledPooling)
[11/08/2024-09:04:31] [V] [TRT] Tactic: 5505281 Time: 0.063012
[11/08/2024-09:04:31] [V] [TRT] Tactic: 5570817 Time: 0.03884
[11/08/2024-09:04:31] [V] [TRT] Tactic: 5636353 Time: 0.03078
[11/08/2024-09:04:31] [V] [TRT] Tactic: 5701889 Time: 0.026668
[11/08/2024-09:04:31] [V] [TRT] Tactic: 5767425 Time: 0.026016
[11/08/2024-09:04:31] [V] [TRT] Tactic: 5832961 Time: 0.022588
[11/08/2024-09:04:31] [V] [TRT] Tactic: 5898497 Time: 0.022084
[11/08/2024-09:04:31] [V] [TRT] Tactic: 5964033 Time: 0.025436
[11/08/2024-09:04:31] [V] [TRT] Tactic: 6029569 Time: 0.033168
[11/08/2024-09:04:31] [V] [TRT] Tactic: 6095105 Time: 0.024424
[11/08/2024-09:04:31] [V] [TRT] Tactic: 6160641 Time: 0.022852
[11/08/2024-09:04:32] [V] [TRT] Tactic: 6226177 Time: 0.01614
[11/08/2024-09:04:32] [V] [TRT] Tactic: 6291713 Time: 0.015036
[11/08/2024-09:04:32] [V] [TRT] Tactic: 6357249 Time: 0.013452
[11/08/2024-09:04:32] [V] [TRT] Tactic: 6422785 Time: 0.013668
[11/08/2024-09:04:32] [V] [TRT] Tactic: 6488321 Time: 0.013548
[11/08/2024-09:04:32] [V] [TRT] Fastest Tactic: 6357249 Time: 0.013452
[11/08/2024-09:04:32] [V] [TRT] --------------- Timing Runner: /pool_2/MaxPool (CudnnPooling)
[11/08/2024-09:04:32] [V] [TRT] CudnnPooling has no valid tactics for this config, skipping
[11/08/2024-09:04:32] [V] [TRT] >>>>>>>>>>>>>>> Chose Runner Type: TiledPooling Tactic: 6357249
[11/08/2024-09:04:32] [V] [TRT] =============== Computing costs for 
[11/08/2024-09:04:32] [V] [TRT] *************** Autotuning format combination: Float(24576,256,16,1) -> Float(24576,256,16,1) ***************
[11/08/2024-09:04:32] [V] [TRT] --------------- Timing Runner: /conv5/Conv + /Relu_4 (CudaDepthwiseConvolution)
[11/08/2024-09:04:32] [V] [TRT] CudaDepthwiseConvolution has no valid tactics for this config, skipping
[11/08/2024-09:04:32] [V] [TRT] --------------- Timing Runner: /conv5/Conv + /Relu_4 (FusedConvActConvolution)
[11/08/2024-09:04:32] [V] [TRT] Tactic: 524287 Time: 0.166552
[11/08/2024-09:04:32] [V] [TRT] Tactic: 720895 Time: 0.197012
[11/08/2024-09:04:32] [V] [TRT] Tactic: 983039 Time: 0.173488
[11/08/2024-09:04:32] [V] [TRT] Tactic: 1048575 Time: 0.143556
[11/08/2024-09:04:32] [V] [TRT] Tactic: 1703935 Time: 0.144348
[11/08/2024-09:04:32] [V] [TRT] Tactic: 1769471 Time: 0.230028
[11/08/2024-09:04:32] [V] [TRT] Tactic: 1966079 Time: 0.164736
[11/08/2024-09:04:32] [V] [TRT] Tactic: 2031615 Time: 0.218388
[11/08/2024-09:04:32] [V] [TRT] Tactic: 2228223 Time: 0.183872
[11/08/2024-09:04:32] [V] [TRT] Tactic: 2424831 Time: 0.138076
[11/08/2024-09:04:32] [V] [TRT] Tactic: 2621439 Time: 0.150064
[11/08/2024-09:04:32] [V] [TRT] Tactic: 2752511 Time: 0.225308
[11/08/2024-09:04:32] [V] [TRT] Tactic: 2818047 Time: 0.331008
[11/08/2024-09:04:32] [V] [TRT] Tactic: 2883583 Time: 0.20178
[11/08/2024-09:04:32] [V] [TRT] Tactic: 3014655 Time: 0.14284
[11/08/2024-09:04:32] [V] [TRT] Tactic: 3145727 Time: 0.22142
[11/08/2024-09:04:32] [V] [TRT] Tactic: 3473407 Time: 0.218372
[11/08/2024-09:04:32] [V] [TRT] Tactic: 3604479 Time: 0.153056
[11/08/2024-09:04:32] [V] [TRT] Tactic: 3735551 Time: 0.18974
[11/08/2024-09:04:33] [V] [TRT] Tactic: 4390911 Time: 0.244628
[11/08/2024-09:04:33] [V] [TRT] Tactic: 5046271 Time: 0.161328
[11/08/2024-09:04:33] [V] [TRT] Tactic: 5963775 Time: 0.195588
[11/08/2024-09:04:33] [V] [TRT] Tactic: 6160383 Time: 0.174924
[11/08/2024-09:04:33] [V] [TRT] Tactic: 6488063 Time: 0.200936
[11/08/2024-09:04:33] [V] [TRT] Tactic: 6881279 Time: 0.224344
[11/08/2024-09:04:33] [V] [TRT] Tactic: 7274495 Time: 0.216844
[11/08/2024-09:04:33] [V] [TRT] Tactic: 7864319 Time: 0.177148
[11/08/2024-09:04:33] [V] [TRT] Tactic: 7995391 Time: 0.149204
[11/08/2024-09:04:33] [V] [TRT] Tactic: 8585215 Time: 0.19826
[11/08/2024-09:04:33] [V] [TRT] Tactic: 8847359 Time: 0.201764
[11/08/2024-09:04:33] [V] [TRT] Tactic: 8978431 Time: 0.194764
[11/08/2024-09:04:33] [V] [TRT] Tactic: 9043967 Time: 0.186788
[11/08/2024-09:04:33] [V] [TRT] Tactic: 9175039 Time: 0.138516
[11/08/2024-09:04:33] [V] [TRT] Tactic: 9502719 Time: 0.248244
[11/08/2024-09:04:33] [V] [TRT] Tactic: 9830399 Time: 0.180048
[11/08/2024-09:04:33] [V] [TRT] Tactic: 9961471 Time: 0.15204
[11/08/2024-09:04:33] [V] [TRT] Tactic: 10027007 Time: 0.1733
[11/08/2024-09:04:33] [V] [TRT] Tactic: 10092543 Time: 0.244504
[11/08/2024-09:04:33] [V] [TRT] Tactic: 10289151 Time: 0.16524
[11/08/2024-09:04:33] [V] [TRT] Tactic: 10485759 Time: 0.170296
[11/08/2024-09:04:33] [V] [TRT] Tactic: 10682367 Time: 0.143476
[11/08/2024-09:04:33] [V] [TRT] Tactic: 10813439 Time: 0.139884
[11/08/2024-09:04:33] [V] [TRT] Fastest Tactic: 2424831 Time: 0.138076
[11/08/2024-09:04:33] [V] [TRT] --------------- Timing Runner: /conv5/Conv + /Relu_4 (CudnnConvolution)
[11/08/2024-09:04:33] [V] [TRT] CudnnConvolution has no valid tactics for this config, skipping
[11/08/2024-09:04:33] [V] [TRT] --------------- Timing Runner: /conv5/Conv + /Relu_4 (CaskConvolution)
[11/08/2024-09:04:33] [V] [TRT] /conv5/Conv + /Relu_4 Set Tactic Name: maxwell_scudnn_128x32_relu_medium_nn_v1 Tactic: 1062367460111450758
[11/08/2024-09:04:33] [V] [TRT] Tactic: 1062367460111450758 Time: 0.219276
[11/08/2024-09:04:33] [V] [TRT] /conv5/Conv + /Relu_4 Set Tactic Name: maxwell_scudnn_128x32_relu_large_nn_v0 Tactic: 1754984623894446479
[11/08/2024-09:04:33] [V] [TRT] Tactic: 1754984623894446479 Time: 0.209408
[11/08/2024-09:04:33] [V] [TRT] /conv5/Conv + /Relu_4 Set Tactic Name: maxwell_scudnn_128x128_relu_large_nn_v0 Tactic: 3611739942397549984
[11/08/2024-09:04:33] [V] [TRT] Tactic: 3611739942397549984 Time: 0.186396
[11/08/2024-09:04:33] [V] [TRT] /conv5/Conv + /Relu_4 Set Tactic Name: maxwell_scudnn_winograd_128x128_ldg1_ldg4_relu_tile148n_nt_v1 Tactic: 3827454225649558724
[11/08/2024-09:04:33] [V] [TRT] Tactic: 3827454225649558724 Time: 0.101308
[11/08/2024-09:04:33] [V] [TRT] /conv5/Conv + /Relu_4 Set Tactic Name: maxwell_scudnn_128x64_relu_large_nn_v1 Tactic: 4337000649858996379
[11/08/2024-09:04:33] [V] [TRT] Tactic: 4337000649858996379 Time: 0.183364
[11/08/2024-09:04:33] [V] [TRT] /conv5/Conv + /Relu_4 Set Tactic Name: maxwell_scudnn_128x128_relu_medium_nn_v1 Tactic: 4501471010995462441
[11/08/2024-09:04:33] [V] [TRT] Tactic: 4501471010995462441 Time: 0.148312
[11/08/2024-09:04:34] [V] [TRT] /conv5/Conv + /Relu_4 Set Tactic Name: maxwell_scudnn_128x64_relu_small_nn_v1 Tactic: 5137655947464784826
[11/08/2024-09:04:34] [V] [TRT] Tactic: 5137655947464784826 Time: 0.141024
[11/08/2024-09:04:34] [V] [TRT] /conv5/Conv + /Relu_4 Set Tactic Name: maxwell_scudnn_128x128_relu_small_nn_v0 Tactic: 5288347012147084929
[11/08/2024-09:04:34] [V] [TRT] Tactic: 5288347012147084929 Time: 0.139048
[11/08/2024-09:04:34] [V] [TRT] /conv5/Conv + /Relu_4 Set Tactic Name: maxwell_scudnn_winograd_128x128_ldg1_ldg4_relu_tile148m_nt_v1 Tactic: 5921334924264294896
[11/08/2024-09:04:34] [V] [TRT] Tactic: 5921334924264294896 Time: 0.071196
[11/08/2024-09:04:34] [V] [TRT] /conv5/Conv + /Relu_4 Set Tactic Name: maxwell_scudnn_128x64_relu_medium_nn_v1 Tactic: 6645123197870846056
[11/08/2024-09:04:34] [V] [TRT] Tactic: 6645123197870846056 Time: 0.157748
[11/08/2024-09:04:34] [V] [TRT] /conv5/Conv + /Relu_4 Set Tactic Name: maxwell_scudnn_128x32_relu_small_nn_v0 Tactic: 7144526460361122478
[11/08/2024-09:04:34] [V] [TRT] Tactic: 7144526460361122478 Time: 0.154352
[11/08/2024-09:04:34] [V] [TRT] /conv5/Conv + /Relu_4 Set Tactic Name: maxwell_scudnn_winograd_128x128_ldg1_ldg4_relu_tile148t_nt_v1 Tactic: 7852627285308570038
[11/08/2024-09:04:34] [V] [TRT] Tactic: 7852627285308570038 Time: 0.082532
[11/08/2024-09:04:34] [V] [TRT] /conv5/Conv + /Relu_4 Set Tactic Name: maxwell_scudnn_128x128_relu_large_nn_v1 Tactic: -9137461792520977713
[11/08/2024-09:04:34] [V] [TRT] Tactic: -9137461792520977713 Time: 0.15242
[11/08/2024-09:04:34] [V] [TRT] /conv5/Conv + /Relu_4 Set Tactic Name: maxwell_scudnn_winograd_128x128_ldg1_ldg4_relu_tile148n_nt_v0 Tactic: -8776506421218919509
[11/08/2024-09:04:34] [V] [TRT] Tactic: -8776506421218919509 Time: 0.095788
[11/08/2024-09:04:34] [V] [TRT] /conv5/Conv + /Relu_4 Set Tactic Name: maxwell_scudnn_128x128_relu_medium_nn_v0 Tactic: -8262349710178828730
[11/08/2024-09:04:34] [V] [TRT] Tactic: -8262349710178828730 Time: 0.162916
[11/08/2024-09:04:34] [V] [TRT] /conv5/Conv + /Relu_4 Set Tactic Name: maxwell_scudnn_128x64_relu_large_nn_v0 Tactic: -8133971918129952780
[11/08/2024-09:04:34] [V] [TRT] Tactic: -8133971918129952780 Time: 0.215608
[11/08/2024-09:04:34] [V] [TRT] /conv5/Conv + /Relu_4 Set Tactic Name: maxwell_scudnn_128x32_relu_large_nn_v1 Tactic: -6092040395344634144
[11/08/2024-09:04:34] [V] [TRT] Tactic: -6092040395344634144 Time: 0.205992
[11/08/2024-09:04:34] [V] [TRT] /conv5/Conv + /Relu_4 Set Tactic Name: maxwell_scudnn_128x32_relu_medium_nn_v0 Tactic: -4787320710726427159
[11/08/2024-09:04:34] [V] [TRT] Tactic: -4787320710726427159 Time: 0.172888
[11/08/2024-09:04:34] [V] [TRT] /conv5/Conv + /Relu_4 Set Tactic Name: maxwell_scudnn_128x32_relu_small_nn_v1 Tactic: -3456450830548107839
[11/08/2024-09:04:34] [V] [TRT] Tactic: -3456450830548107839 Time: 0.159692
[11/08/2024-09:04:34] [V] [TRT] /conv5/Conv + /Relu_4 Set Tactic Name: maxwell_scudnn_winograd_128x128_ldg1_ldg4_relu_tile148t_nt_v0 Tactic: -2318106587342035239
[11/08/2024-09:04:34] [V] [TRT] Tactic: -2318106587342035239 Time: 0.087152
[11/08/2024-09:04:34] [V] [TRT] /conv5/Conv + /Relu_4 Set Tactic Name: maxwell_scudnn_winograd_128x128_ldg1_ldg4_mobile_relu_tile148t_nt_v0 Tactic: -1343271414618805657
[11/08/2024-09:04:34] [V] [TRT] Tactic: -1343271414618805657 Time: 0.063928
[11/08/2024-09:04:34] [V] [TRT] /conv5/Conv + /Relu_4 Set Tactic Name: maxwell_scudnn_128x64_relu_medium_nn_v0 Tactic: -1218658103698133241
[11/08/2024-09:04:34] [V] [TRT] Tactic: -1218658103698133241 Time: 0.202256
[11/08/2024-09:04:34] [V] [TRT] /conv5/Conv + /Relu_4 Set Tactic Name: maxwell_scudnn_128x64_relu_small_nn_v0 Tactic: -836875257600482091
[11/08/2024-09:04:34] [V] [TRT] Tactic: -836875257600482091 Time: 0.189644
[11/08/2024-09:04:34] [V] [TRT] /conv5/Conv + /Relu_4 Set Tactic Name: maxwell_scudnn_128x128_relu_small_nn_v1 Tactic: -410470605513481746
[11/08/2024-09:04:34] [V] [TRT] Tactic: -410470605513481746 Time: 0.138504
[11/08/2024-09:04:34] [V] [TRT] Fastest Tactic: -1343271414618805657 Time: 0.063928
[11/08/2024-09:04:34] [V] [TRT] >>>>>>>>>>>>>>> Chose Runner Type: CaskConvolution Tactic: -1343271414618805657
[11/08/2024-09:04:34] [V] [TRT] *************** Autotuning format combination: Float(24576,1,1536,96) -> Float(24576,1,1536,96) ***************
[11/08/2024-09:04:34] [V] [TRT] --------------- Timing Runner: /conv5/Conv + /Relu_4 (CudnnConvolution)
[11/08/2024-09:04:34] [V] [TRT] CudnnConvolution has no valid tactics for this config, skipping
[11/08/2024-09:04:34] [V] [TRT] --------------- Timing Runner: /conv5/Conv + /Relu_4 (CaskConvolution)
[11/08/2024-09:04:34] [V] [TRT] /conv5/Conv + /Relu_4 Set Tactic Name: maxwell_scudnn_128x32_sliced1x4_ldg4_relu_exp_small_nhwc_tn_v1 Tactic: -9153228964338181824
[11/08/2024-09:04:34] [V] [TRT] Tactic: -9153228964338181824 Time: 0.135144
[11/08/2024-09:04:34] [V] [TRT] /conv5/Conv + /Relu_4 Set Tactic Name: maxwell_scudnn_128x64_sliced1x2_ldg4_relu_exp_small_nhwc_tn_v1 Tactic: -7394439838318485025
[11/08/2024-09:04:34] [V] [TRT] Tactic: -7394439838318485025 Time: 0.121384
[11/08/2024-09:04:34] [V] [TRT] Fastest Tactic: -7394439838318485025 Time: 0.121384
[11/08/2024-09:04:34] [V] [TRT] >>>>>>>>>>>>>>> Chose Runner Type: CaskConvolution Tactic: -7394439838318485025
[11/08/2024-09:04:34] [V] [TRT] =============== Computing costs for 
